{ "type": "decision_record", "id": "dr-1", "decision": "offer_brief constrains message_brief on the factual claim", "owner": "product_enforcer", "rationale": "the product_verifiable_claim must be true; the market_promise may not exceed it on facts", "precedence_basis": "offer_brief(60) outranks message_brief(50) on verifiable claims", "confidence": 0.9, "arbitration_needed": false }
